{
 "format": "cc-claim-ledger/0.1",
 "variables": [
  {
   "var_id": "348f2e4fd79958efaee5c648fe4c88612ffab5f494f6d0365f2d159e9d015fc4",
   "name": "legit_burst_attempts_min",
   "position": 6
  },
  {
   "var_id": "3586eeb4e768b03bf38b085e7eeb42367c8045eb6436ac7e4e82f87d2d0ca3ed",
   "name": "abuse_planned_attempts_min",
   "position": 5
  },
  {
   "var_id": "b98464874325e8105e15b27f80f9cbef7d41199f55d57f87d02fe251e9b63c7c",
   "name": "pref_write_ratio",
   "position": 24
  },
  {
   "var_id": "f9d9d4bb45b9bf1bd02212e3b6c3cc22461ecf5d87268b303003090d568e65d7",
   "name": "pref_search_ratio",
   "position": 21
  },
  {
   "var_id": "9a7d455793f23621ac2ca391dc9fa4dd5d9b505a5ba59707ab23262ada41fad7",
   "name": "pref_analytics_ratio",
   "position": 20
  },
  {
   "var_id": "aa321d12e651d6e44d5c6bb92fcf4c4654e1917c7e344d55ff8a0dfb63d57aee",
   "name": "bot_score_threshold",
   "position": 7
  },
  {
   "var_id": "d28a32f2120810ed25453ce5a9eee87183c8596ae562a4fb666da6183495082b",
   "name": "global_rate_limit_tokens",
   "position": 13
  },
  {
   "var_id": "bdbfd2158c213fa11f1fc2dffb30004070c4e70ef59ec9e5a52f80db4e9c0fa9",
   "name": "write_quota_tokens",
   "position": 15
  },
  {
   "var_id": "3316ecbe171086273cfdb9a410df91cd1de0ccfadd8179435c4f79a00649da95",
   "name": "search_quota_tokens",
   "position": 3
  },
  {
   "var_id": "bae61c1895fb4dbcabf752a5568b79803329debbabfe8d2532be77a0ef974fa9",
   "name": "analytics_quota_tokens",
   "position": 9
  },
  {
   "var_id": "6a66a0f9483849fbf8b60d93a6eb895dc6a5c87462a4c33a1a10302e3ed308c4",
   "name": "compute_pool_capacity_vcpu",
   "position": 1
  },
  {
   "var_id": "f8a19ef24f6e0e9c47f54735c20c59cabbe84ebdcbc164d8678fe6678b10425d",
   "name": "db_connection_pool_capacity",
   "position": 14
  },
  {
   "var_id": "833b74bef25a14dc11247ee4504f315e65a8d9ca3c0f9bd574417be8659973bb",
   "name": "bot_pass_rate",
   "position": 23
  },
  {
   "var_id": "d747fce1d443a1cf0b20834dbf64dd94fbd9303456d35727a2c80f2dac9f45c7",
   "name": "admitted_write_count",
   "position": 17
  },
  {
   "var_id": "d237d6b03fa9d5547f0300696a9d429bfae56949111883834155b0954005f1e9",
   "name": "throttled_write_429",
   "position": 10
  },
  {
   "var_id": "484bfa78319f044583757d7582ea4a53e4509842bc153c68486b243636d48530",
   "name": "admitted_search_count",
   "position": 11
  },
  {
   "var_id": "5812751571fa82ce7b6ce7aef72f8fc63d2e66bdfb5ea3c031e57b5a2352457c",
   "name": "throttled_search_429",
   "position": 0
  },
  {
   "var_id": "e2daca1d64ba58bd93518f70d58ca845783f7ccf9da1f195d58e002d065c245a",
   "name": "cache_hit_ratio_search",
   "position": 22
  },
  {
   "var_id": "39e798ae6d421e650c1f8941f0391fcf5eb670dd50398eec90c231ddfec4c923",
   "name": "admitted_analytics_count",
   "position": 19
  },
  {
   "var_id": "d58e6b5f3033d6dc786a4ca1b5487432127052cd47bfeadcc27acd84db49b4b1",
   "name": "throttled_analytics_429",
   "position": 18
  },
  {
   "var_id": "98eab181ba9e6671565774f5619ba75dff2cd3d7547018d63ac8fd00632e85ce",
   "name": "cpu_utilization_pct",
   "position": 16
  },
  {
   "var_id": "0dfe8fba39cd3d3f0ac07e6f6f85390b8f3f59047f45fee481abde3a5d3e83b1",
   "name": "db_lock_wait_ms",
   "position": 2
  },
  {
   "var_id": "babcb05e85cabc909fb9a41b1dfb8917305b02611af2b139ba49b716a72f9a3b",
   "name": "p95_latency_overall_ms",
   "position": 12
  },
  {
   "var_id": "45f9f4ad92234a35fa54aa778a87eceea7d4d4598f504655c7fa568d4ca57b25",
   "name": "retry_attempts_total",
   "position": 4
  },
  {
   "var_id": "91abccafb0fd869290500be2b96dbbb1122c392bf1f8fe2417102940c368af9f",
   "name": "legitimate_failures_count",
   "position": 8
  }
 ],
 "evidence": [],
 "knowledge": [
  {
   "id": "k1",
   "kind": "forbidden_edge",
   "content": {
    "from": "legit_burst_attempts_min",
    "to": "throttled_write_429"
   },
   "supplier": {
    "type": "person",
    "shown": [
     "true graph of the public file (test fixture)",
     "the tool's data-only output"
    ]
   }
  }
 ],
 "claims": [
  {
   "id": "c:abuse_planned_attempts_min|legit_burst_attempts_min",
   "x": "abuse_planned_attempts_min",
   "y": "legit_burst_attempts_min",
   "relation": "x->y",
   "direction_source": "none",
   "licensed_by": "none",
   "evidence": [],
   "data_only_relation": "x->y",
   "knowledge": [],
   "tool_mark": "<--"
  },
  {
   "id": "c:pref_write_ratio|legit_burst_attempts_min",
   "x": "pref_write_ratio",
   "y": "legit_burst_attempts_min",
   "relation": "x->y",
   "direction_source": "none",
   "licensed_by": "none",
   "evidence": [],
   "data_only_relation": "x->y",
   "knowledge": [],
   "tool_mark": "<--"
  },
  {
   "id": "c:pref_search_ratio|legit_burst_attempts_min",
   "x": "pref_search_ratio",
   "y": "legit_burst_attempts_min",
   "relation": "x->y",
   "direction_source": "none",
   "licensed_by": "none",
   "evidence": [],
   "data_only_relation": "x->y",
   "knowledge": [],
   "tool_mark": "<--"
  },
  {
   "id": "c:pref_analytics_ratio|legit_burst_attempts_min",
   "x": "pref_analytics_ratio",
   "y": "legit_burst_attempts_min",
   "relation": "x->y",
   "direction_source": "none",
   "licensed_by": "none",
   "evidence": [],
   "data_only_relation": "x->y",
   "knowledge": [],
   "tool_mark": "<--"
  },
  {
   "id": "c:bot_score_threshold|legit_burst_attempts_min",
   "x": "bot_score_threshold",
   "y": "legit_burst_attempts_min",
   "relation": "x->y",
   "direction_source": "none",
   "licensed_by": "none",
   "evidence": [],
   "data_only_relation": "x->y",
   "knowledge": [],
   "tool_mark": "<--"
  },
  {
   "id": "c:legit_burst_attempts_min|global_rate_limit_tokens",
   "x": "legit_burst_attempts_min",
   "y": "global_rate_limit_tokens",
   "relation": "none",
   "direction_source": "none",
   "licensed_by": "none",
   "evidence": [],
   "data_only_relation": "none",
   "knowledge": []
  },
  {
   "id": "c:legit_burst_attempts_min|write_quota_tokens",
   "x": "legit_burst_attempts_min",
   "y": "write_quota_tokens",
   "relation": "none",
   "direction_source": "none",
   "licensed_by": "none",
   "evidence": [],
   "data_only_relation": "none",
   "knowledge": []
  },
  {
   "id": "c:legit_burst_attempts_min|search_quota_tokens",
   "x": "legit_burst_attempts_min",
   "y": "search_quota_tokens",
   "relation": "none",
   "direction_source": "none",
   "licensed_by": "none",
   "evidence": [],
   "data_only_relation": "none",
   "knowledge": []
  },
  {
   "id": "c:legit_burst_attempts_min|analytics_quota_tokens",
   "x": "legit_burst_attempts_min",
   "y": "analytics_quota_tokens",
   "relation": "none",
   "direction_source": "none",
   "licensed_by": "none",
   "evidence": [],
   "data_only_relation": "none",
   "knowledge": []
  },
  {
   "id": "c:legit_burst_attempts_min|compute_pool_capacity_vcpu",
   "x": "legit_burst_attempts_min",
   "y": "compute_pool_capacity_vcpu",
   "relation": "none",
   "direction_source": "none",
   "licensed_by": "none",
   "evidence": [],
   "data_only_relation": "none",
   "knowledge": []
  },
  {
   "id": "c:legit_burst_attempts_min|db_connection_pool_capacity",
   "x": "legit_burst_attempts_min",
   "y": "db_connection_pool_capacity",
   "relation": "none",
   "direction_source": "none",
   "licensed_by": "none",
   "evidence": [],
   "data_only_relation": "none",
   "knowledge": []
  },
  {
   "id": "c:bot_pass_rate|legit_burst_attempts_min",
   "x": "bot_pass_rate",
   "y": "legit_burst_attempts_min",
   "relation": "x->y",
   "direction_source": "none",
   "licensed_by": "none",
   "evidence": [],
   "data_only_relation": "x->y",
   "knowledge": [],
   "tool_mark": "<--"
  },
  {
   "id": "c:admitted_write_count|legit_burst_attempts_min",
   "x": "admitted_write_count",
   "y": "legit_burst_attempts_min",
   "relation": "x->y",
   "direction_source": "none",
   "licensed_by": "none",
   "evidence": [],
   "data_only_relation": "x->y",
   "knowledge": [],
   "tool_mark": "<--"
  },
  {
   "id": "c:legit_burst_attempts_min|throttled_write_429",
   "x": "legit_burst_attempts_min",
   "y": "throttled_write_429",
   "relation": "none",
   "direction_source": "none",
   "licensed_by": "none",
   "evidence": [],
   "data_only_relation": "x->y",
   "knowledge": []
  },
  {
   "id": "c:admitted_search_count|legit_burst_attempts_min",
   "x": "admitted_search_count",
   "y": "legit_burst_attempts_min",
   "relation": "x->y",
   "direction_source": "none",
   "licensed_by": "none",
   "evidence": [],
   "data_only_relation": "x->y",
   "knowledge": [],
   "tool_mark": "<--"
  },
  {
   "id": "c:throttled_search_429|legit_burst_attempts_min",
   "x": "throttled_search_429",
   "y": "legit_burst_attempts_min",
   "relation": "x->y",
   "direction_source": "none",
   "licensed_by": "none",
   "evidence": [],
   "data_only_relation": "x->y",
   "knowledge": [],
   "tool_mark": "<--"
  },
  {
   "id": "c:cache_hit_ratio_search|legit_burst_attempts_min",
   "x": "cache_hit_ratio_search",
   "y": "legit_burst_attempts_min",
   "relation": "x->y",
   "direction_source": "none",
   "licensed_by": "none",
   "evidence": [],
   "data_only_relation": "x->y",
   "knowledge": [],
   "tool_mark": "<--"
  },
  {
   "id": "c:admitted_analytics_count|legit_burst_attempts_min",
   "x": "admitted_analytics_count",
   "y": "legit_burst_attempts_min",
   "relation": "x->y",
   "direction_source": "none",
   "licensed_by": "none",
   "evidence": [],
   "data_only_relation": "x->y",
   "knowledge": [],
   "tool_mark": "<--"
  },
  {
   "id": "c:legit_burst_attempts_min|throttled_analytics_429",
   "x": "legit_burst_attempts_min",
   "y": "throttled_analytics_429",
   "relation": "x->y",
   "direction_source": "none",
   "licensed_by": "none",
   "evidence": [],
   "data_only_relation": "x->y",
   "knowledge": []
  },
  {
   "id": "c:legit_burst_attempts_min|cpu_utilization_pct",
   "x": "legit_burst_attempts_min",
   "y": "cpu_utilization_pct",
   "relation": "none",
   "direction_source": "none",
   "licensed_by": "none",
   "evidence": [],